[
  {
    "is_synthetic": true,
    "id": "ASN-0001",
    "ticket_id": "WO-0003",
    "team_id": "TEAM-ES-CLOUD",
    "assignee_id": "USR-015",
    "assigned_at": "2026-10-23T22:40:03Z",
    "approved_by": "USR-051",
    "decision": "human_confirmed",
    "rule_version": "ROUTE-DEMO-V1"
  },
  {
    "is_synthetic": true,
    "id": "ASN-0002",
    "ticket_id": "WO-0004",
    "team_id": "TEAM-GB-CLOUD",
    "assignee_id": "USR-021",
    "assigned_at": "2026-10-23T18:24:56Z",
    "approved_by": "USR-051",
    "decision": "human_confirmed",
    "rule_version": "ROUTE-DEMO-V1"
  },
  {
    "is_synthetic": true,
    "id": "ASN-0003",
    "ticket_id": "WO-0005",
    "team_id": "TEAM-AU-CLOUD",
    "assignee_id": "USR-027",
    "assigned_at": "2026-10-23T14:38:52Z",
    "approved_by": "USR-051",
    "decision": "human_confirmed",
    "rule_version": "ROUTE-DEMO-V1"
  },
  {
    "is_synthetic": true,
    "id": "ASN-0004",
    "ticket_id": "WO-0006",
    "team_id": "TEAM-CN-CLOUD",
    "assignee_id": "USR-033",
    "assigned_at": "2026-10-23T11:04:26Z",
    "approved_by": "USR-051",
    "decision": "human_confirmed",
    "rule_version": "ROUTE-DEMO-V1"
  },
  {
    "is_synthetic": true,
    "id": "ASN-0005",
    "ticket_id": "WO-0007",
    "team_id": "TEAM-FR-CLOUD",
    "assignee_id": "USR-039",
    "assigned_at": "2026-10-23T09:53:13Z",
    "approved_by": "USR-051",
    "decision": "human_confirmed",
    "rule_version": "ROUTE-DEMO-V1"
  },
  {
    "is_synthetic": true,
    "id": "ASN-0006",
    "ticket_id": "WO-0008",
    "team_id": "TEAM-IT-CLOUD",
    "assignee_id": "USR-045",
    "assigned_at": "2026-10-23T04:54:56Z",
    "approved_by": "USR-051",
    "decision": "human_confirmed",
    "rule_version": "ROUTE-DEMO-V1"
  },
  {
    "is_synthetic": true,
    "id": "ASN-0007",
    "ticket_id": "WO-0012",
    "team_id": "TEAM-ES-TECHNICAL",
    "assignee_id": "USR-013",
    "assigned_at": "2026-10-23T09:22:12Z",
    "approved_by": "USR-051",
    "decision": "human_confirmed",
    "rule_version": "ROUTE-DEMO-V1"
  },
  {
    "is_synthetic": true,
    "id": "ASN-0008",
    "ticket_id": "WO-0013",
    "team_id": "TEAM-GB-TECHNICAL",
    "assignee_id": "USR-019",
    "assigned_at": "2026-10-22T23:42:02Z",
    "approved_by": "USR-051",
    "decision": "human_confirmed",
    "rule_version": "ROUTE-DEMO-V1"
  },
  {
    "is_synthetic": true,
    "id": "ASN-0009",
    "ticket_id": "WO-0014",
    "team_id": "TEAM-AU-TECHNICAL",
    "assignee_id": "USR-025",
    "assigned_at": "2026-10-22T17:13:27Z",
    "approved_by": "USR-051",
    "decision": "human_confirmed",
    "rule_version": "ROUTE-DEMO-V1"
  },
  {
    "is_synthetic": true,
    "id": "ASN-0010",
    "ticket_id": "WO-0015",
    "team_id": "TEAM-CN-TECHNICAL",
    "assignee_id": "USR-031",
    "assigned_at": "2026-10-22T12:01:30Z",
    "approved_by": "USR-051",
    "decision": "human_confirmed",
    "rule_version": "ROUTE-DEMO-V1"
  },
  {
    "is_synthetic": true,
    "id": "ASN-0011",
    "ticket_id": "WO-0016",
    "team_id": "TEAM-FR-TECHNICAL",
    "assignee_id": "USR-037",
    "assigned_at": "2026-10-22T12:27:48Z",
    "approved_by": "USR-051",
    "decision": "human_confirmed",
    "rule_version": "ROUTE-DEMO-V1"
  },
  {
    "is_synthetic": true,
    "id": "ASN-0012",
    "ticket_id": "WO-0017",
    "team_id": "TEAM-IT-TECHNICAL",
    "assignee_id": "USR-043",
    "assigned_at": "2026-10-22T04:46:59Z",
    "approved_by": "USR-051",
    "decision": "human_confirmed",
    "rule_version": "ROUTE-DEMO-V1"
  },
  {
    "is_synthetic": true,
    "id": "ASN-0013",
    "ticket_id": "WO-0019",
    "team_id": "TEAM-NL-TECHNICAL",
    "assignee_id": "USR-007",
    "assigned_at": "2026-10-22T05:19:19Z",
    "approved_by": "USR-051",
    "decision": "human_confirmed",
    "rule_version": "ROUTE-DEMO-V1"
  },
  {
    "is_synthetic": true,
    "id": "ASN-0014",
    "ticket_id": "WO-0021",
    "team_id": "TEAM-ES-TECHNICAL",
    "assignee_id": "USR-013",
    "assigned_at": "2026-10-22T20:04:21Z",
    "approved_by": "USR-051",
    "decision": "human_confirmed",
    "rule_version": "ROUTE-DEMO-V1"
  },
  {
    "is_synthetic": true,
    "id": "ASN-0015",
    "ticket_id": "WO-0022",
    "team_id": "TEAM-GB-TECHNICAL",
    "assignee_id": "USR-019",
    "assigned_at": "2026-10-22T04:59:08Z",
    "approved_by": "USR-051",
    "decision": "human_confirmed",
    "rule_version": "ROUTE-DEMO-V1"
  },
  {
    "is_synthetic": true,
    "id": "ASN-0016",
    "ticket_id": "WO-0023",
    "team_id": "TEAM-AU-TECHNICAL",
    "assignee_id": "USR-025",
    "assigned_at": "2026-10-21T19:48:01Z",
    "approved_by": "USR-051",
    "decision": "human_confirmed",
    "rule_version": "ROUTE-DEMO-V1"
  },
  {
    "is_synthetic": true,
    "id": "ASN-0017",
    "ticket_id": "WO-0024",
    "team_id": "TEAM-CN-TECHNICAL",
    "assignee_id": "USR-031",
    "assigned_at": "2026-10-21T12:58:33Z",
    "approved_by": "USR-051",
    "decision": "human_confirmed",
    "rule_version": "ROUTE-DEMO-V1"
  },
  {
    "is_synthetic": true,
    "id": "ASN-0018",
    "ticket_id": "WO-0025",
    "team_id": "TEAM-FR-TECHNICAL",
    "assignee_id": "USR-037",
    "assigned_at": "2026-10-21T15:02:22Z",
    "approved_by": "USR-051",
    "decision": "human_confirmed",
    "rule_version": "ROUTE-DEMO-V1"
  },
  {
    "is_synthetic": true,
    "id": "ASN-0019",
    "ticket_id": "WO-0026",
    "team_id": "TEAM-IT-TECHNICAL",
    "assignee_id": "USR-043",
    "assigned_at": "2026-10-21T04:39:02Z",
    "approved_by": "USR-051",
    "decision": "human_confirmed",
    "rule_version": "ROUTE-DEMO-V1"
  },
  {
    "is_synthetic": true,
    "id": "ASN-0020",
    "ticket_id": "WO-0028",
    "team_id": "TEAM-NL-TECHNICAL",
    "assignee_id": "USR-007",
    "assigned_at": "2026-10-21T07:53:54Z",
    "approved_by": "USR-051",
    "decision": "human_confirmed",
    "rule_version": "ROUTE-DEMO-V1"
  },
  {
    "is_synthetic": true,
    "id": "ASN-0021",
    "ticket_id": "WO-0031",
    "team_id": "TEAM-GB-CLOUD",
    "assignee_id": "USR-021",
    "assigned_at": "2026-10-21T10:16:14Z",
    "approved_by": "USR-051",
    "decision": "human_confirmed",
    "rule_version": "ROUTE-DEMO-V1"
  },
  {
    "is_synthetic": true,
    "id": "ASN-0022",
    "ticket_id": "WO-0032",
    "team_id": "TEAM-AU-CLOUD",
    "assignee_id": "USR-027",
    "assigned_at": "2026-10-20T22:22:36Z",
    "approved_by": "USR-051",
    "decision": "human_confirmed",
    "rule_version": "ROUTE-DEMO-V1"
  },
  {
    "is_synthetic": true,
    "id": "ASN-0023",
    "ticket_id": "WO-0033",
    "team_id": "TEAM-CN-CLOUD",
    "assignee_id": "USR-033",
    "assigned_at": "2026-10-20T13:55:37Z",
    "approved_by": "USR-051",
    "decision": "human_confirmed",
    "rule_version": "ROUTE-DEMO-V1"
  },
  {
    "is_synthetic": true,
    "id": "ASN-0024",
    "ticket_id": "WO-0034",
    "team_id": "TEAM-FR-CLOUD",
    "assignee_id": "USR-039",
    "assigned_at": "2026-10-20T17:36:57Z",
    "approved_by": "USR-051",
    "decision": "human_confirmed",
    "rule_version": "ROUTE-DEMO-V1"
  },
  {
    "is_synthetic": true,
    "id": "ASN-0025",
    "ticket_id": "WO-0035",
    "team_id": "TEAM-IT-CLOUD",
    "assignee_id": "USR-045",
    "assigned_at": "2026-10-20T04:31:05Z",
    "approved_by": "USR-051",
    "decision": "human_confirmed",
    "rule_version": "ROUTE-DEMO-V1"
  },
  {
    "is_synthetic": true,
    "id": "ASN-0026",
    "ticket_id": "WO-0039",
    "team_id": "TEAM-GB-CLOUD",
    "assignee_id": "USR-021",
    "assigned_at": "2026-10-21T17:28:39Z",
    "approved_by": "USR-051",
    "decision": "human_confirmed",
    "rule_version": "ROUTE-DEMO-V1"
  },
  {
    "is_synthetic": true,
    "id": "ASN-0027",
    "ticket_id": "WO-0040",
    "team_id": "TEAM-AU-CLOUD",
    "assignee_id": "USR-027",
    "assigned_at": "2026-10-20T15:33:20Z",
    "approved_by": "USR-051",
    "decision": "human_confirmed",
    "rule_version": "ROUTE-DEMO-V1"
  },
  {
    "is_synthetic": true,
    "id": "ASN-0028",
    "ticket_id": "WO-0041",
    "team_id": "TEAM-AU-TECHNICAL",
    "assignee_id": "USR-025",
    "assigned_at": "2026-10-20T00:57:10Z",
    "approved_by": "USR-051",
    "decision": "human_confirmed",
    "rule_version": "ROUTE-DEMO-V1"
  },
  {
    "is_synthetic": true,
    "id": "ASN-0029",
    "ticket_id": "WO-0042",
    "team_id": "TEAM-CN-TECHNICAL",
    "assignee_id": "USR-031",
    "assigned_at": "2026-10-19T14:52:40Z",
    "approved_by": "USR-051",
    "decision": "human_confirmed",
    "rule_version": "ROUTE-DEMO-V1"
  },
  {
    "is_synthetic": true,
    "id": "ASN-0030",
    "ticket_id": "WO-0043",
    "team_id": "TEAM-FR-TECHNICAL",
    "assignee_id": "USR-037",
    "assigned_at": "2026-10-19T20:11:31Z",
    "approved_by": "USR-051",
    "decision": "human_confirmed",
    "rule_version": "ROUTE-DEMO-V1"
  },
  {
    "is_synthetic": true,
    "id": "ASN-0031",
    "ticket_id": "WO-0044",
    "team_id": "TEAM-IT-TECHNICAL",
    "assignee_id": "USR-043",
    "assigned_at": "2026-10-19T04:23:08Z",
    "approved_by": "USR-051",
    "decision": "human_confirmed",
    "rule_version": "ROUTE-DEMO-V1"
  },
  {
    "is_synthetic": true,
    "id": "ASN-0032",
    "ticket_id": "WO-0048",
    "team_id": "TEAM-GB-TECHNICAL",
    "assignee_id": "USR-019",
    "assigned_at": "2026-10-21T04:10:48Z",
    "approved_by": "USR-051",
    "decision": "human_confirmed",
    "rule_version": "ROUTE-DEMO-V1"
  },
  {
    "is_synthetic": true,
    "id": "ASN-0033",
    "ticket_id": "WO-0049",
    "team_id": "TEAM-AU-TECHNICAL",
    "assignee_id": "USR-025",
    "assigned_at": "2026-10-19T20:50:26Z",
    "approved_by": "USR-051",
    "decision": "human_confirmed",
    "rule_version": "ROUTE-DEMO-V1"
  },
  {
    "is_synthetic": true,
    "id": "ASN-0034",
    "ticket_id": "WO-0050",
    "team_id": "TEAM-CN-TECHNICAL",
    "assignee_id": "USR-031",
    "assigned_at": "2026-10-19T03:31:45Z",
    "approved_by": "USR-051",
    "decision": "human_confirmed",
    "rule_version": "ROUTE-DEMO-V1"
  },
  {